1,COLOR,Butter Yellow,Soft buttery yellow trending heavily across luxury and mid-market spring lines,Vogue April 2026,5,Spring2026,Global,PEAK,-1,2026-04-28,ACTIVE
2,SILHOUETTE,Drop-Waist Dresses,Drop-waist silhouettes regaining popularity; driven by 1920s revival,Pinterest Trend Report,4,Fall2026,North America,RISING,-1,2026-04-28,ACTIVE
3,FABRIC,Recycled Polyester Blends,Sustainability-driven push toward recycled poly blends in core basics,Sourcing Journal,4,Fall2026,Global,RISING,-1,2026-04-28,ACTIVE
4,CONSUMER_BEHAVIOR,Quiet Luxury Demand,Sustained shift toward unbranded; high-quality basics; cap on logo placement,Field Survey,3,Spring2026,Europe,EMERGING,-1,2026-04-28,ACTIVE
5,FABRIC,Merino Wool Resurgence,Merino wool comeback driven by performance-luxury crossover,Field Survey,5,Fall2026,Global,RISING,-1,2026-04-28,ACTIVE
6,COLOR,Lavender Haze,Soft lavender tones; emerging signal,Instagram,2,Spring2026,Europe,EMERGING,-1,2026-04-28,ACTIVE
7,COLOR,Red Brown,Red Brown is hip for this season,Instagram,5,Summer2027,Asia,PEAK,-1,2026-04-28,ACTIVE
